{
  "format_version": 1,
  "format": "udl-attempt-events",
  "generated_at": "2026-10-12T01:11:00.000Z",
  "producer": {
    "shell": "udl-lesson-reader",
    "shell_version": "v1",
    "granularity": "unit"
  },
  "actor": {
    "role": "student",
    "student_code": "fox-07"
  },
  "context": {
    "session_id": "demo-stream-bridge-quiz-20261012T011000000Z",
    "mode": "test",
    "pack": {
      "id": "sample-willow",
      "version": "0.1.0"
    },
    "unit_id": "u01-stream-bridge",
    "prescription": {
      "zhuyin": true,
      "read_aloud": "student-choice"
    }
  },
  "events": [
    {
      "seq": 1,
      "type": "session-started",
      "time": "2026-10-12T01:10:00.000Z"
    },
    {
      "seq": 2,
      "type": "answered",
      "time": "2026-10-12T01:10:05.000Z",
      "item_id": "demo-stream-bridge-quiz-1",
      "ladder_ids": [
        "5-Ⅲ-3#a@6"
      ],
      "question_type": "choice",
      "type_version": 1,
      "outcome": "correct",
      "score": 1,
      "attempt_no": 1,
      "response_ms": 5200,
      "hint_tier": 0,
      "read_aloud": null,
      "guess_flag": "none",
      "response": {
        "chosen": "img-bridge"
      },
      "detail": {
        "kind": "sent-pic",
        "prompt": "溪水慢慢地流過石橋。",
        "correct": "img-bridge",
        "key": ""
      },
      "curriculum_codes": [
        "5-Ⅲ-3"
      ]
    },
    {
      "seq": 3,
      "type": "answered",
      "time": "2026-10-12T01:10:12.000Z",
      "item_id": "demo-stream-bridge-quiz-2",
      "ladder_ids": [
        "5-Ⅲ-3#a@6"
      ],
      "question_type": "choice",
      "type_version": 1,
      "outcome": "incorrect",
      "score": 0,
      "attempt_no": 1,
      "response_ms": 3900,
      "hint_tier": 0,
      "read_aloud": null,
      "guess_flag": "none",
      "response": {
        "chosen": "img-market"
      },
      "detail": {
        "kind": "sent-pic",
        "prompt": "橋上的遊客絡繹不絕。",
        "correct": "img-crowd",
        "key": ""
      },
      "curriculum_codes": [
        "5-Ⅲ-3"
      ]
    },
    {
      "seq": 4,
      "type": "answered",
      "time": "2026-10-12T01:10:25.000Z",
      "item_id": "demo-stream-bridge-quiz-3",
      "ladder_ids": [
        "5-Ⅲ-3#a@6"
      ],
      "question_type": "choice",
      "type_version": 1,
      "outcome": "correct",
      "score": 1,
      "attempt_no": 1,
      "response_ms": 7600,
      "hint_tier": 0,
      "read_aloud": null,
      "guess_flag": "none",
      "response": {
        "chosen": "太陽從山後面探出頭來。"
      },
      "detail": {
        "kind": "pic-sent",
        "prompt": "img-sunrise",
        "correct": "太陽從山後面探出頭來。",
        "key": ""
      },
      "curriculum_codes": [
        "5-Ⅲ-3"
      ]
    },
    {
      "seq": 5,
      "type": "answered",
      "time": "2026-10-12T01:10:33.000Z",
      "item_id": "demo-stream-bridge-quiz-4",
      "ladder_ids": [
        "5-Ⅲ-3#a@6"
      ],
      "question_type": "choice",
      "type_version": 1,
      "outcome": "correct",
      "score": 1,
      "attempt_no": 1,
      "response_ms": 4400,
      "hint_tier": 0,
      "read_aloud": null,
      "guess_flag": "none",
      "response": {
        "chosen": "img-clear"
      },
      "detail": {
        "kind": "sent-pic",
        "prompt": "水很清澈，看得見底。",
        "correct": "img-clear",
        "key": ""
      },
      "curriculum_codes": [
        "5-Ⅲ-3"
      ]
    },
    {
      "seq": 6,
      "type": "session-completed",
      "time": "2026-10-12T01:10:34.000Z",
      "summary": {
        "answered": 4,
        "correct": 3,
        "duration_ms": 34000
      }
    }
  ]
}
